lys@DESKTOP-A5GME2Q MINGW64 ~/Desktop/photoProject (case1/before)
$ artillery run portfolio/case1/raw/artillery/before-rps-100-60s.yml
Test run id: t3bdz_ntdntk8n6ztzye6rwfpmrfpbeadwa_6z4c
Phase started: unnamed (index: 0, duration: 60s) 17:33:33(+0900)

--------------------------------------
Metrics for period to: 17:33:40(+0900) (width: 6.897s)
--------------------------------------

http.codes.200: ................................................................ 666
http.downloaded_bytes: ......................................................... 3335328
http.request_rate: ............................................................. 100/sec
http.requests: ................................................................. 679
http.response_time:
  min: ......................................................................... 8
  max: ......................................................................... 243
  mean: ........................................................................ 47.5
  median: ...................................................................... 26.8
  p95: ......................................................................... 153
  p99: ......................................................................... 214.9
http.response_time.2xx:
  min: ......................................................................... 8
  max: ......................................................................... 243
  mean: ........................................................................ 47.5
  median: ...................................................................... 26.8
  p95: ......................................................................... 153
  p99: ......................................................................... 214.9
http.responses: ................................................................ 666
vusers.completed: .............................................................. 666
vusers.created: ................................................................ 680
vusers.created_by_name.GET posts (before) 100rps 60s: .......................... 680
vusers.failed: ................................................................. 0
vusers.session_length:
  min: ......................................................................... 22.4
  max: ......................................................................... 353.4
  mean: ........................................................................ 58.3
  median: ...................................................................... 32.8
  p95: ......................................................................... 179.5
  p99: ......................................................................... 257.3


--------------------------------------
Metrics for period to: 17:33:50(+0900) (width: 9.999s)
--------------------------------------

http.codes.200: ................................................................ 1011
http.downloaded_bytes: ......................................................... 5063088
http.request_rate: ............................................................. 100/sec
http.requests: ................................................................. 1000
http.response_time:
  min: ......................................................................... 16
  max: ......................................................................... 438
  mean: ........................................................................ 53.7
  median: ...................................................................... 27.9
  p95: ......................................................................... 179.5
  p99: ......................................................................... 284.3
http.response_time.2xx:
  min: ......................................................................... 16
  max: ......................................................................... 438
  mean: ........................................................................ 53.7
  median: ...................................................................... 27.9
  p95: ......................................................................... 179.5
  p99: ......................................................................... 284.3
http.responses: ................................................................ 1011
vusers.completed: .............................................................. 1011
vusers.created: ................................................................ 1000
vusers.created_by_name.GET posts (before) 100rps 60s: .......................... 1000
vusers.failed: ................................................................. 0
vusers.session_length:
  min: ......................................................................... 22.4
  max: ......................................................................... 454.7
  mean: ........................................................................ 62.5
  median: ...................................................................... 34.1
  p95: ......................................................................... 206.5
  p99: ......................................................................... 301.9


--------------------------------------
Metrics for period to: 17:34:00(+0900) (width: 9.984s)
--------------------------------------

http.codes.200: ................................................................ 990
http.downloaded_bytes: ......................................................... 4957920
http.request_rate: ............................................................. 100/sec
http.requests: ................................................................. 997
http.response_time:
  min: ......................................................................... 16
  max: ......................................................................... 659
  mean: ........................................................................ 84.6
  median: ...................................................................... 36.2
  p95: ......................................................................... 295.9
  p99: ......................................................................... 468.8
http.response_time.2xx:
  min: ......................................................................... 16
  max: ......................................................................... 659
  mean: ........................................................................ 84.6
  median: ...................................................................... 36.2
  p95: ......................................................................... 295.9
  p99: ......................................................................... 468.8
http.responses: ................................................................ 990
vusers.completed: .............................................................. 990
vusers.created: ................................................................ 996
vusers.created_by_name.GET posts (before) 100rps 60s: .......................... 996
vusers.failed: ................................................................. 0
vusers.session_length:
  min: ......................................................................... 20.9
  max: ......................................................................... 662.4
  mean: ........................................................................ 94.7
  median: ...................................................................... 47
  p95: ......................................................................... 314.2
  p99: ......................................................................... 478.3


--------------------------------------
Metrics for period to: 17:34:10(+0900) (width: 9.999s)
--------------------------------------

http.codes.200: ................................................................ 1010
http.downloaded_bytes: ......................................................... 5058080
http.request_rate: ............................................................. 100/sec
http.requests: ................................................................. 1003
http.response_time:
  min: ......................................................................... 9
  max: ......................................................................... 273
  mean: ........................................................................ 41
  median: ...................................................................... 26.8
  p95: ......................................................................... 127.8
  p99: ......................................................................... 190.6
http.response_time.2xx:
  min: ......................................................................... 9
  max: ......................................................................... 273
  mean: ........................................................................ 41
  median: ...................................................................... 26.8
  p95: ......................................................................... 127.8
  p99: ......................................................................... 190.6
http.responses: ................................................................ 1010
vusers.completed: .............................................................. 1010
vusers.created: ................................................................ 1004
vusers.created_by_name.GET posts (before) 100rps 60s: .......................... 1004
vusers.failed: ................................................................. 0
vusers.session_length:
  min: ......................................................................... 20.6
  max: ......................................................................... 394.4
  mean: ........................................................................ 49.4
  median: ...................................................................... 32.1
  p95: ......................................................................... 153
  p99: ......................................................................... 228.2


--------------------------------------
Metrics for period to: 17:34:20(+0900) (width: 9.999s)
--------------------------------------

http.codes.200: ................................................................ 1000
http.downloaded_bytes: ......................................................... 5008000
http.request_rate: ............................................................. 100/sec
http.requests: ................................................................. 1000
http.response_time:
  min: ......................................................................... 0
  max: ......................................................................... 206
  mean: ........................................................................ 38.4
  median: ...................................................................... 27.9
  p95: ......................................................................... 102.5
  p99: ......................................................................... 159.2
http.response_time.2xx:
  min: ......................................................................... 0
  max: ......................................................................... 206
  mean: ........................................................................ 38.4
  median: ...................................................................... 27.9
  p95: ......................................................................... 102.5
  p99: ......................................................................... 159.2
http.responses: ................................................................ 1000
vusers.completed: .............................................................. 1000
vusers.created: ................................................................ 1000
vusers.created_by_name.GET posts (before) 100rps 60s: .......................... 1000
vusers.failed: ................................................................. 0
vusers.session_length:
  min: ......................................................................... 20.9
  max: ......................................................................... 332.7
  mean: ........................................................................ 47.1
  median: ...................................................................... 34.1
  p95: ......................................................................... 122.7
  p99: ......................................................................... 183.1


--------------------------------------
Metrics for period to: 17:34:30(+0900) (width: 9.992s)
--------------------------------------

http.codes.200: ................................................................ 953
http.downloaded_bytes: ......................................................... 4772624
http.request_rate: ............................................................. 100/sec
http.requests: ................................................................. 1000
http.response_time:
  min: ......................................................................... 1
  max: ......................................................................... 693
  mean: ........................................................................ 75.1
  median: ...................................................................... 27.9
  p95: ......................................................................... 267.8
  p99: ......................................................................... 497.8
http.response_time.2xx:
  min: ......................................................................... 1
  max: ......................................................................... 693
  mean: ........................................................................ 75.1
  median: ...................................................................... 27.9
  p95: ......................................................................... 267.8
  p99: ......................................................................... 497.8
http.responses: ................................................................ 953
vusers.completed: .............................................................. 953
vusers.created: ................................................................ 999
vusers.created_by_name.GET posts (before) 100rps 60s: .......................... 999
vusers.failed: ................................................................. 0
vusers.session_length:
  min: ......................................................................... 21.6
  max: ......................................................................... 698.7
  mean: ........................................................................ 85
  median: ...................................................................... 34.1
  p95: ......................................................................... 301.9
  p99: ......................................................................... 497.8


Phase completed: unnamed (index: 0, duration: 60s) 17:34:33(+0900)

--------------------------------------
Metrics for period to: 17:34:40(+0900) (width: 3.333s)
--------------------------------------

http.codes.200: ................................................................ 370
http.downloaded_bytes: ......................................................... 1852960
http.request_rate: ............................................................. 103/sec
http.requests: ................................................................. 321
http.response_time:
  min: ......................................................................... 23
  max: ......................................................................... 1153
  mean: ........................................................................ 273.6
  median: ...................................................................... 223.7
  p95: ......................................................................... 561.2
  p99: ......................................................................... 871.5
http.response_time.2xx:
  min: ......................................................................... 23
  max: ......................................................................... 1153
  mean: ........................................................................ 273.6
  median: ...................................................................... 223.7
  p95: ......................................................................... 561.2
  p99: ......................................................................... 871.5
http.responses: ................................................................ 370
vusers.completed: .............................................................. 370
vusers.created: ................................................................ 321
vusers.created_by_name.GET posts (before) 100rps 60s: .......................... 321
vusers.failed: ................................................................. 0
vusers.session_length:
  min: ......................................................................... 26
  max: ......................................................................... 1156.6
  mean: ........................................................................ 289.7
  median: ...................................................................... 237.5
  p95: ......................................................................... 584.2
  p99: ......................................................................... 871.5


All VUs finished. Total time: 1 minute, 2 seconds

--------------------------------
Summary report @ 17:34:35(+0900)
--------------------------------

http.codes.200: ................................................................ 6000
http.downloaded_bytes: ......................................................... 30048000
http.request_rate: ............................................................. 100/sec
http.requests: ................................................................. 6000
http.response_time:
  min: ......................................................................... 0
  max: ......................................................................... 1153
  mean: ........................................................................ 70.4
  median: ...................................................................... 29.1
  p95: ......................................................................... 262.5
  p99: ......................................................................... 497.8
http.response_time.2xx:
  min: ......................................................................... 0
  max: ......................................................................... 1153
  mean: ........................................................................ 70.4
  median: ...................................................................... 29.1
  p95: ......................................................................... 262.5
  p99: ......................................................................... 497.8
http.responses: ................................................................ 6000
vusers.completed: .............................................................. 6000
vusers.created: ................................................................ 6000
vusers.created_by_name.GET posts (before) 100rps 60s: .......................... 6000
vusers.failed: ................................................................. 0
vusers.session_length:
  min: ......................................................................... 20.6
  max: ......................................................................... 1156.6
  mean: ........................................................................ 80.2
  median: ...................................................................... 35.5
  p95: ......................................................................... 284.3
  p99: ......................................................................... 507.8


