lys@DESKTOP-A5GME2Q MINGW64 ~/Desktop/photoProject/portfolio/case3/artillery (master)
$ artillery run case3_get_posts.yml
Test run id: thxw8_gy3fz3gzjqqaynnhadydtmr59kpbj_9wme
Phase started: unnamed (index: 0, duration: 120s) 22:29:15(+0900)

--------------------------------------
Metrics for period to: 22:29:20(+0900) (width: 3.185s)
--------------------------------------

http.codes.200: ................................................................ 12
http.downloaded_bytes: ......................................................... 61584
http.request_rate: ............................................................. 4/sec
http.requests: ................................................................. 16
http.response_time:
  min: ......................................................................... 786
  max: ......................................................................... 834
  mean: ........................................................................ 809
  median: ...................................................................... 804.5
  p95: ......................................................................... 820.7
  p99: ......................................................................... 820.7
http.response_time.2xx:
  min: ......................................................................... 786
  max: ......................................................................... 834
  mean: ........................................................................ 809
  median: ...................................................................... 804.5
  p95: ......................................................................... 820.7
  p99: ......................................................................... 820.7
http.responses: ................................................................ 12
vusers.completed: .............................................................. 12
vusers.created: ................................................................ 16
vusers.created_by_name.Case3 - GET /api/posts paging: .......................... 16
vusers.failed: ................................................................. 0
vusers.session_length:
  min: ......................................................................... 790.1
  max: ......................................................................... 857.5
  mean: ........................................................................ 819.7
  median: ...................................................................... 820.7
  p95: ......................................................................... 837.3
  p99: ......................................................................... 837.3


--------------------------------------
Metrics for period to: 22:29:30(+0900) (width: 9.371s)
--------------------------------------

http.codes.200: ................................................................ 40
http.downloaded_bytes: ......................................................... 205280
http.request_rate: ............................................................. 4/sec
http.requests: ................................................................. 40
http.response_time:
  min: ......................................................................... 779
  max: ......................................................................... 947
  mean: ........................................................................ 817.8
  median: ...................................................................... 804.5
  p95: ......................................................................... 925.4
  p99: ......................................................................... 944
http.response_time.2xx:
  min: ......................................................................... 779
  max: ......................................................................... 947
  mean: ........................................................................ 817.8
  median: ...................................................................... 804.5
  p95: ......................................................................... 925.4
  p99: ......................................................................... 944
http.responses: ................................................................ 40
vusers.completed: .............................................................. 40
vusers.created: ................................................................ 40
vusers.created_by_name.Case3 - GET /api/posts paging: .......................... 40
vusers.failed: ................................................................. 0
vusers.session_length:
  min: ......................................................................... 781.9
  max: ......................................................................... 950.4
  mean: ........................................................................ 820.9
  median: ...................................................................... 804.5
  p95: ......................................................................... 925.4
  p99: ......................................................................... 944


--------------------------------------
Metrics for period to: 22:29:40(+0900) (width: 9.407s)
--------------------------------------

http.codes.200: ................................................................ 40
http.downloaded_bytes: ......................................................... 205280
http.request_rate: ............................................................. 4/sec
http.requests: ................................................................. 40
http.response_time:
  min: ......................................................................... 773
  max: ......................................................................... 1022
  mean: ........................................................................ 838.3
  median: ...................................................................... 804.5
  p95: ......................................................................... 982.6
  p99: ......................................................................... 982.6
http.response_time.2xx:
  min: ......................................................................... 773
  max: ......................................................................... 1022
  mean: ........................................................................ 838.3
  median: ...................................................................... 804.5
  p95: ......................................................................... 982.6
  p99: ......................................................................... 982.6
http.responses: ................................................................ 40
vusers.completed: .............................................................. 40
vusers.created: ................................................................ 40
vusers.created_by_name.Case3 - GET /api/posts paging: .......................... 40
vusers.failed: ................................................................. 0
vusers.session_length:
  min: ......................................................................... 776.3
  max: ......................................................................... 1024.6
  mean: ........................................................................ 841
  median: ...................................................................... 804.5
  p95: ......................................................................... 982.6
  p99: ......................................................................... 1002.4


--------------------------------------
Metrics for period to: 22:29:50(+0900) (width: 9.36s)
--------------------------------------

http.codes.200: ................................................................ 40
http.downloaded_bytes: ......................................................... 205280
http.request_rate: ............................................................. 4/sec
http.requests: ................................................................. 40
http.response_time:
  min: ......................................................................... 774
  max: ......................................................................... 877
  mean: ........................................................................ 803.1
  median: ...................................................................... 788.5
  p95: ......................................................................... 871.5
  p99: ......................................................................... 871.5
http.response_time.2xx:
  min: ......................................................................... 774
  max: ......................................................................... 877
  mean: ........................................................................ 803.1
  median: ...................................................................... 788.5
  p95: ......................................................................... 871.5
  p99: ......................................................................... 871.5
http.responses: ................................................................ 40
vusers.completed: .............................................................. 40
vusers.created: ................................................................ 40
vusers.created_by_name.Case3 - GET /api/posts paging: .......................... 40
vusers.failed: ................................................................. 0
vusers.session_length:
  min: ......................................................................... 776.4
  max: ......................................................................... 879.4
  mean: ........................................................................ 806
  median: ...................................................................... 788.5
  p95: ......................................................................... 871.5
  p99: ......................................................................... 871.5


--------------------------------------
Metrics for period to: 22:30:00(+0900) (width: 9.386s)
--------------------------------------

http.codes.200: ................................................................ 40
http.downloaded_bytes: ......................................................... 205280
http.request_rate: ............................................................. 4/sec
http.requests: ................................................................. 40
http.response_time:
  min: ......................................................................... 792
  max: ......................................................................... 1187
  mean: ........................................................................ 879.9
  median: ...................................................................... 820.7
  p95: ......................................................................... 1085.9
  p99: ......................................................................... 1107.9
http.response_time.2xx:
  min: ......................................................................... 792
  max: ......................................................................... 1187
  mean: ........................................................................ 879.9
  median: ...................................................................... 820.7
  p95: ......................................................................... 1085.9
  p99: ......................................................................... 1107.9
http.responses: ................................................................ 40
vusers.completed: .............................................................. 40
vusers.created: ................................................................ 40
vusers.created_by_name.Case3 - GET /api/posts paging: .......................... 40
vusers.failed: ................................................................. 0
vusers.session_length:
  min: ......................................................................... 795.4
  max: ......................................................................... 1190
  mean: ........................................................................ 883.5
  median: ...................................................................... 820.7
  p95: ......................................................................... 1107.9
  p99: ......................................................................... 1107.9


--------------------------------------
Metrics for period to: 22:30:10(+0900) (width: 9.368s)
--------------------------------------

http.codes.200: ................................................................ 40
http.downloaded_bytes: ......................................................... 205280
http.request_rate: ............................................................. 4/sec
http.requests: ................................................................. 40
http.response_time:
  min: ......................................................................... 804
  max: ......................................................................... 927
  mean: ........................................................................ 857.7
  median: ...................................................................... 854.2
  p95: ......................................................................... 925.4
  p99: ......................................................................... 925.4
http.response_time.2xx:
  min: ......................................................................... 804
  max: ......................................................................... 927
  mean: ........................................................................ 857.7
  median: ...................................................................... 854.2
  p95: ......................................................................... 925.4
  p99: ......................................................................... 925.4
http.responses: ................................................................ 40
vusers.completed: .............................................................. 40
vusers.created: ................................................................ 40
vusers.created_by_name.Case3 - GET /api/posts paging: .......................... 40
vusers.failed: ................................................................. 0
vusers.session_length:
  min: ......................................................................... 806.7
  max: ......................................................................... 930
  mean: ........................................................................ 860.2
  median: ...................................................................... 854.2
  p95: ......................................................................... 925.4
  p99: ......................................................................... 925.4


--------------------------------------
Metrics for period to: 22:30:20(+0900) (width: 9.373s)
--------------------------------------

http.codes.200: ................................................................ 40
http.downloaded_bytes: ......................................................... 205280
http.request_rate: ............................................................. 4/sec
http.requests: ................................................................. 40
http.response_time:
  min: ......................................................................... 792
  max: ......................................................................... 909
  mean: ........................................................................ 831.7
  median: ...................................................................... 837.3
  p95: ......................................................................... 871.5
  p99: ......................................................................... 889.1
http.response_time.2xx:
  min: ......................................................................... 792
  max: ......................................................................... 909
  mean: ........................................................................ 831.7
  median: ...................................................................... 837.3
  p95: ......................................................................... 871.5
  p99: ......................................................................... 889.1
http.responses: ................................................................ 40
vusers.completed: .............................................................. 40
vusers.created: ................................................................ 40
vusers.created_by_name.Case3 - GET /api/posts paging: .......................... 40
vusers.failed: ................................................................. 0
vusers.session_length:
  min: ......................................................................... 794.3
  max: ......................................................................... 910.9
  mean: ........................................................................ 834
  median: ...................................................................... 837.3
  p95: ......................................................................... 871.5
  p99: ......................................................................... 889.1


--------------------------------------
Metrics for period to: 22:30:30(+0900) (width: 9.267s)
--------------------------------------

http.codes.200: ................................................................ 40
http.downloaded_bytes: ......................................................... 205280
http.request_rate: ............................................................. 4/sec
http.requests: ................................................................. 40
http.response_time:
  min: ......................................................................... 795
  max: ......................................................................... 951
  mean: ........................................................................ 855.3
  median: ...................................................................... 837.3
  p95: ......................................................................... 944
  p99: ......................................................................... 944
http.response_time.2xx:
  min: ......................................................................... 795
  max: ......................................................................... 951
  mean: ........................................................................ 855.3
  median: ...................................................................... 837.3
  p95: ......................................................................... 944
  p99: ......................................................................... 944
http.responses: ................................................................ 40
vusers.completed: .............................................................. 40
vusers.created: ................................................................ 40
vusers.created_by_name.Case3 - GET /api/posts paging: .......................... 40
vusers.failed: ................................................................. 0
vusers.session_length:
  min: ......................................................................... 797.4
  max: ......................................................................... 953.9
  mean: ........................................................................ 857.8
  median: ...................................................................... 837.3
  p95: ......................................................................... 944
  p99: ......................................................................... 944


--------------------------------------
Metrics for period to: 22:30:40(+0900) (width: 9.376s)
--------------------------------------

http.codes.200: ................................................................ 40
http.downloaded_bytes: ......................................................... 205280
http.request_rate: ............................................................. 4/sec
http.requests: ................................................................. 40
http.response_time:
  min: ......................................................................... 765
  max: ......................................................................... 1462
  mean: ........................................................................ 881.4
  median: ...................................................................... 837.3
  p95: ......................................................................... 1085.9
  p99: ......................................................................... 1380.5
http.response_time.2xx:
  min: ......................................................................... 765
  max: ......................................................................... 1462
  mean: ........................................................................ 881.4
  median: ...................................................................... 837.3
  p95: ......................................................................... 1085.9
  p99: ......................................................................... 1380.5
http.responses: ................................................................ 40
vusers.completed: .............................................................. 40
vusers.created: ................................................................ 40
vusers.created_by_name.Case3 - GET /api/posts paging: .......................... 40
vusers.failed: ................................................................. 0
vusers.session_length:
  min: ......................................................................... 767.5
  max: ......................................................................... 1463.8
  mean: ........................................................................ 885.8
  median: ...................................................................... 837.3
  p95: ......................................................................... 1085.9
  p99: ......................................................................... 1380.5


--------------------------------------
Metrics for period to: 22:30:50(+0900) (width: 9.416s)
--------------------------------------

http.codes.200: ................................................................ 40
http.downloaded_bytes: ......................................................... 205280
http.request_rate: ............................................................. 4/sec
http.requests: ................................................................. 40
http.response_time:
  min: ......................................................................... 766
  max: ......................................................................... 954
  mean: ........................................................................ 808
  median: ...................................................................... 788.5
  p95: ......................................................................... 907
  p99: ......................................................................... 925.4
http.response_time.2xx:
  min: ......................................................................... 766
  max: ......................................................................... 954
  mean: ........................................................................ 808
  median: ...................................................................... 788.5
  p95: ......................................................................... 907
  p99: ......................................................................... 925.4
http.responses: ................................................................ 40
vusers.completed: .............................................................. 40
vusers.created: ................................................................ 40
vusers.created_by_name.Case3 - GET /api/posts paging: .......................... 40
vusers.failed: ................................................................. 0
vusers.session_length:
  min: ......................................................................... 768.1
  max: ......................................................................... 962.3
  mean: ........................................................................ 810.4
  median: ...................................................................... 788.5
  p95: ......................................................................... 925.4
  p99: ......................................................................... 925.4


--------------------------------------
Metrics for period to: 22:31:00(+0900) (width: 9.413s)
--------------------------------------

http.codes.200: ................................................................ 40
http.downloaded_bytes: ......................................................... 205280
http.request_rate: ............................................................. 4/sec
http.requests: ................................................................. 40
http.response_time:
  min: ......................................................................... 766
  max: ......................................................................... 862
  mean: ........................................................................ 792.3
  median: ...................................................................... 788.5
  p95: ......................................................................... 837.3
  p99: ......................................................................... 854.2
http.response_time.2xx:
  min: ......................................................................... 766
  max: ......................................................................... 862
  mean: ........................................................................ 792.3
  median: ...................................................................... 788.5
  p95: ......................................................................... 837.3
  p99: ......................................................................... 854.2
http.responses: ................................................................ 40
vusers.completed: .............................................................. 40
vusers.created: ................................................................ 40
vusers.created_by_name.Case3 - GET /api/posts paging: .......................... 40
vusers.failed: ................................................................. 0
vusers.session_length:
  min: ......................................................................... 768.9
  max: ......................................................................... 864.2
  mean: ........................................................................ 794.5
  median: ...................................................................... 788.5
  p95: ......................................................................... 837.3
  p99: ......................................................................... 854.2


--------------------------------------
Metrics for period to: 22:31:10(+0900) (width: 9.395s)
--------------------------------------

http.codes.200: ................................................................ 40
http.downloaded_bytes: ......................................................... 205280
http.request_rate: ............................................................. 4/sec
http.requests: ................................................................. 40
http.response_time:
  min: ......................................................................... 776
  max: ......................................................................... 1339
  mean: ........................................................................ 928.3
  median: ...................................................................... 907
  p95: ......................................................................... 1176.4
  p99: ......................................................................... 1200.1
http.response_time.2xx:
  min: ......................................................................... 776
  max: ......................................................................... 1339
  mean: ........................................................................ 928.3
  median: ...................................................................... 907
  p95: ......................................................................... 1176.4
  p99: ......................................................................... 1200.1
http.responses: ................................................................ 40
vusers.completed: .............................................................. 40
vusers.created: ................................................................ 40
vusers.created_by_name.Case3 - GET /api/posts paging: .......................... 40
vusers.failed: ................................................................. 0
vusers.session_length:
  min: ......................................................................... 778.1
  max: ......................................................................... 1342.8
  mean: ........................................................................ 933
  median: ...................................................................... 907
  p95: ......................................................................... 1176.4
  p99: ......................................................................... 1200.1


Phase completed: unnamed (index: 0, duration: 120s) 22:31:15(+0900)

--------------------------------------
Metrics for period to: 22:31:20(+0900) (width: 6.107s)
--------------------------------------

http.codes.200: ................................................................ 28
http.downloaded_bytes: ......................................................... 143696
http.request_rate: ............................................................. 4/sec
http.requests: ................................................................. 24
http.response_time:
  min: ......................................................................... 828
  max: ......................................................................... 1015
  mean: ........................................................................ 914.9
  median: ...................................................................... 907
  p95: ......................................................................... 1002.4
  p99: ......................................................................... 1022.7
http.response_time.2xx:
  min: ......................................................................... 828
  max: ......................................................................... 1015
  mean: ........................................................................ 914.9
  median: ...................................................................... 907
  p95: ......................................................................... 1002.4
  p99: ......................................................................... 1022.7
http.responses: ................................................................ 28
vusers.completed: .............................................................. 28
vusers.created: ................................................................ 24
vusers.created_by_name.Case3 - GET /api/posts paging: .......................... 24
vusers.failed: ................................................................. 0
vusers.session_length:
  min: ......................................................................... 829.9
  max: ......................................................................... 1017.1
  mean: ........................................................................ 917.4
  median: ...................................................................... 907
  p95: ......................................................................... 1022.7
  p99: ......................................................................... 1022.7


All VUs finished. Total time: 2 minutes, 2 seconds

--------------------------------
Summary report @ 22:31:18(+0900)
--------------------------------

http.codes.200: ................................................................ 480
http.downloaded_bytes: ......................................................... 2463360
http.request_rate: ............................................................. 4/sec
http.requests: ................................................................. 480
http.response_time:
  min: ......................................................................... 765
  max: ......................................................................... 1462
  mean: ........................................................................ 848.1
  median: ...................................................................... 820.7
  p95: ......................................................................... 1022.7
  p99: ......................................................................... 1176.4
http.response_time.2xx:
  min: ......................................................................... 765
  max: ......................................................................... 1462
  mean: ........................................................................ 848.1
  median: ...................................................................... 820.7
  p95: ......................................................................... 1022.7
  p99: ......................................................................... 1176.4
http.responses: ................................................................ 480
vusers.completed: .............................................................. 480
vusers.created: ................................................................ 480
vusers.created_by_name.Case3 - GET /api/posts paging: .......................... 480
vusers.failed: ................................................................. 0
vusers.session_length:
  min: ......................................................................... 767.5
  max: ......................................................................... 1463.8
  mean: ........................................................................ 851.3
  median: ...................................................................... 820.7
  p95: ......................................................................... 1022.7
  p99: ......................................................................... 1176.4
